Gốc (Reference)                                                         , Máy đoán (Prediction)
minh nhật hồng quân vũ công thành sưu tầm từ báo nước ngoài             , minh quân họng quân vũa công thành sư tập từ báo nước ngoài
muốn có bằng lái phải qua một đợt thi rất khắt khe                      , vũng có đặng ấy phải qua một được thi đức khác khe
yêu nhau khoảng vài tháng thì chúng tôi đã có quan hệ tình dục          , yêu nhau khoảng vài tháng thì chúng tôi đã có quan hề nghề
khó sao duyên dám cho anh uống rượu trong đám cưới                      , khoa sau dùyên giám chành uốn rụ trong đám cưới
ông dương đức lân phó tổng cục trưởng tổng cục dạy nghề                 , ông dương đước lân phó tậm cục trưỡng tập cũng dạy nghề
đối xử với bạn như người yêu cũ của bạn đã từng làm                     , đối sử với bạn như người yêu của của bạn đã từng làm
tham gia thiết kế lăng chủ tịch hồ chí minh thì có nhiều người          , tham dà thiết kế lăng chủ tịch hồ chứ mình thị có nhiều người
vì vậy công ty b phải có trách nhiệm bồi thường                         , về vậy công ty bê phải có trách nhiệm bồi thường
nông dân trồng mía than cứ một vụ được lại ba vụ thất                   , nong dân trọng mấyết hang cứ một vụ lại được ba vụ thức
thì người xem cũng được nâng cao kiến thức về địa lý                    , thì người sem cũng được nâng cao kiến thất với đị lấy
ngày xưa các cụ làm bìa sách là minh hoạ cho cuốn sách đó               , ngày xưa các củ làm bị sách là minh hạ cho cuốn sách đó
tôi đã nhiều lần phản đối quyết liệt việc nước thải tuồn ra ngoài       , sối đã nhiều luận phản đối quyết liệp việt nước thải tuốn đam ngoại
nhiều gia đình hiện nay thích tự giới thiệu chương trình                , nhiều gia đình hiện nay hích tử giễ thịu trung trình
tôi là một người miền tây đang là nghiên cứu sinh ở mỹ                  , tôi là một người miền tay đen là nghiên cứu sinh ở mễ
càng đi sâu vào bên trong cảnh trí thiên nhiên càng hùng vĩ             , kỳ đi sau và bình trong cảnh chứ thiên nhiên càng hụng vỹ
mong bạn bình tâm suy nghĩ và chọn được cách giải quyết tốt nhất        , mong bạn bình tâm sự nghĩ vào chọn được cách giải quyết tốt nhấp
điều này khó hơn khi bạn vào bàn tiệc toàn người xa lạ                  , điều này khỏ hơn khi bạn rồ bạn tịa toàn ngời sa lạ
cũng đều trong tư thế ngõ nhỏ phố nhỏ phở tôi ở đó                      , cũng đều trong từ thể ngó phố phố nhỏ phỡ tôi ở đó
thành một chiếc lồng đèn khổng lồ tại công viên ở thủ đô bắc kinh       , thấn mồ chết lòn nèn khổng lồ tại cong viên ở thủ đố bắt kinh
câu chuyện của quá khứ ông kể không biết bao nhiêu lần                  , cơ cho tràn của qua qua khứ ông cải khống biết bao nhau làn
màu son trông thật tuyệt trên bất kì màu da nào                         , một son trong thịa chấy bất kỳ mầu gia nào
ông ăn chay mà nghĩ mặn thì ăn chay làm chi                             , ông anh chay mạng ủy mạnh thị anh chay làm chiết
trên cơ sở đó những hành vi vi phạm sẽ được xử lý nghiêm                , chchen cơ sợ đó nhấn hàn viên vi phi phạm sẽ đợt sựa lý nghiêm
một cơ quan chính thức để khách hàng khiếu nại tham khảo và tin tưởng   , một cơ quan chiến thức đã khác hàng khi�a nại tham khảo và tiến tượng
một tình huống ứng xử sư phạm tôi làm bộ tỉnh rụi được cô duyệt         , một tiện hướng hướng ứng sự sư phạm tôi là một tịn ruội được của xuốt
chẳng lẽ ăn cơm nhà người mà lại không chăm chú lắng nghe người nói     , chấn léanh cơm nhà ngơi mà lại không chấm chủ nắng ngang người nổi
nghĩa là nếu bạn đang làm việc dưới quyền một giám sát viên             , nghĩa là nễu bạc đang làm việc giễ quyền một sảm xa viên
kẽm có nhiều trong gan sò thịt đỏ cá óc trứng                           , kẻm có nhiều trong can sò tiệt đỏ cá óc chứng
ung thư từ một cơ quan khác di căn vào hệ thống hạch bạch huyết         , ông thư từ một cơ quan khác can vào thố em thống hay khoe bài khuyết
cuộc thi tự hào sử việt đã hết giai đoạn i                              , cuộc thi tự lạo sự vệt đã hế xa đoạn
cuộc biểu tình của áo đỏ có thể sẽ biến thành bạo lực                   , của biệt triền của áo đỏ có thể sẽ biến than bảo lực
trên thực tế một cuộc điều tra đã được tiến hành                        , channh thực tẻ một cuộc điều tra nã đơc tiển hạn
trải dài hàng chục cây số đều thu gọn vào tầm mắt                       , chảy giài hàng chục cây số đào thua gọn vào tài mắt
thản nhiên giá đó thì chỉ có thể làm vậy thôi                           , thao chiếc giá đó thì chỉ có thể làm vậy thôi
bắt đầu cuộc chạy đua mùa kinh doanh tết giữa bánh nội và bánh ngoại    , bác đầu cuộc chạy đua mùa kinh doan té sửa bản nối và bản ngoại
cái nhà hát bị đập tan tành ông khoái lắm à                             , cái nhà ha bị đập tanh tàn ông khoái lấm à
mâm cơm vẫn thanh đạm tủ áo của vợ cũng chỉ vài bộ đơn sơ               , mamm cơm vấn than đạm tủ áo của vào cũng chỉ vầy với đết giờ
hình thức kỷ luật nào cũng chỉ có tính định hướng răn đe                , hình thất kỷ luật nào cũng chỉ có tiếng điện hướng ranh đéa
hiện nay bà đang bị nhiều bệnh và sống dưới mức nghèo khổ               , hiện nay bà đang bị nhiều bạn và sống giới mức ngào hỗ
nằm trên giường gần cả tháng bất giác tôi cảm thấy mình thật cô độc     , nam chay giờ gờn gọn cả thản bất chờ tôi cảm thối mền thật cô độc
nhảm nhí khi giờ học chán phèo buồn ngủ quá ờ buồn ngủ                  , nhậm dễ khi giờ học chản phèo buồn ngộ quá ở buồn ngủ
nói chuyện một hồi ông làm bộ để tay lên tay em trên cần số             , nộ trên bộ thời ông là bộ để tay len tay em trên cần xuỗ
còn anh trai tôi trong nhật ký của mình cũng linh cảm điều đó           , còn anh cháy tôi trong nhật kiểu của miền cũng liên cảm điều đó
sáng chúng tôi tạm biệt thung nai và những chủ nhân mến khách mộc mạc   , sáng chuống tôi tạm biệt thung nay vài những chủ nhaunh mẹn khác đột mà
mấy ngày đầu thúy hà phải nhờ kim dẫn đi giới thiệu trường              , mản ngày đầu thủy hà phải nhờ kim giảnh đi giữ thiếu trường
họ thích nghi với văn hóa công ty như thế nào                           , họ thiêng nghi với vanh hóa công ty như thể nào
mô hình cấu trúc chức năng và khoa học xã hội mang tính giáo dục        , mâu hiện cố chuốt chất năng và khoa học sả hội ban tiễn giảo dột
và bạn cần có việc làm ổn định với thu nhập cao                         , và bạn cần cổ việc làm ổn đẹn với thuối nhập cao
đây là tháng có số đăng ký thấp nhất từ đầu năm đến nay                 , đây là thản có số đang kỹ thấp nhất từ đầu nam đến nay
thật ra thì cũng không thể làm cầu kì như ở nhà được                    , thật ra thì cũng không thải làm cầu kỳ nhớ ở nhạ được
vả lại theo quy chế đây là trách nhiệm của mỗi thí sinh                 , phải lại theo kiao chế đây là chấn nhạm của mỗi thi xin
công nhân đang thi công hai nhánh cầu rạch chiếc ảnh thuận thắng        , cóm nhân đang thia công hay nhắng cầu rạt chiết ản thuận thấn
họ không biết chơi phòng ngự là gì trừ khi bị đối thủ vây ép            , họ khống biết chơi phong ngực là gì chừ khi bị đổi thủ vay áp
cuối cùng họ dẫn nhau về nhà với thúng làn không                        , cuối cùng họ giễnh nhau về nhà với thống làn không
phim mới của trương nghệ mưu sự trở lại dòng phim nghệ thuật            , phim mới của trơn ngại mơ sự chợ lại dòng phim ngại thọt
còn hàng trăm chiếc khác đã bán thì ông không nhớ hết                   , còn hạo cham chất hắt đã bán thì ông không nhữ hết
cùng vợ ăn vội chén cơm thành lại lo ôn bài làm bài tập                 , cũng vợ ăn vộ chén côm thành lệ lo ôm bài làm bài tập
đội nào thành tích càng cao thì quản lý càng khó                        , đội nào thành tích càng cao thi quản lý càng khó
phải chăng xây dựng niềm tin vào tình yêu khó thế                       , phải chang phay dận niềm tin vào tình yêu khó thế
còn ba cầu thủ văn trương bật hiếu và hải lâm thì sao thưa ông          , còn bạc cầu thủ văng thước bật hiếu và hại làm thì sao thư ông
tháng bảy nhiều người con khóc nên trời buồn và khóc theo               , tháng bảy nhiều người con khóc nên trời buồn và khóc theo
ca khúc được khán giả yêu thích nhất bà tôi nguyễn vĩnh tiến            , ca cúc được hát giả yêu thích nhất bà tôi nguyễn vịn tiếng
đầu tư tiêu dùng và xuất khẩu đều sẽ tăng mạnh                          , đầu tư tiêu dùng và suốt khẩu đều sẽ tăng mạnh
đồ cổ không công khai nguồn gốc phải bị coi là hàng giả                 , đồ cổ không công khai nguồn gấp vẫy bị coi là hàng giả
từng là chủ tế hàng trăm lễ an táng mộ gió                              , từng là chủ tế hành trăm lạ ăn tán mộ gió
hình như không có cả một trong hai tài và đức                           , hình như không có cả một trong hai tài và đức
bên cạnh đó chúng tôi còn làm hàng loạt việc khác như                   , bên cạnh đó chúng tôi còn làm hàng lạc việc khác như
chúng nó yêu nhau rất tự nhiên ghét nhau cũng rất tự nhiên              , chúng nói yêu nhau rất tự nhiên ghét nhau cũng rất tự nhiên
tất cả để cho người bệnh và thân nhân hài lòng khi đến bệnh viện        , tất cả để cho người bệnh và thân nhân hài lòng khí đến địn viện
tôi khẽ chớp mắt và thầm cầu nguyện xin chúa giúp con                   , tôi khẻ chấp mắt và thầm cầu nguyện sinh chú giúp con
lúc hưng phấn nói chuyện phóng lao chẳng có chi phức tạp                , lúc hơn phấn phấn nói chuyện phóng lao chận có chuy phức tạp
sẽ làm chúng ta ngủ không đủ không đúng quy luật                        , sẽ làm chúng ta ngủ không đủ không đúng quy luật
có bao giờ ông gặp tình huống không trả lời được câu hỏi của dân        , có bao giờ ông gặp tình huống không trả lời lời được câu hỏi của dân
cả đời chưa bao giờ tôi có cảm giác sung sướng như vậy                  , cá đời chứ bao giờ tôi có cảm giác xuống xướng như vậy
ít có cơ hội sống sót cho các hành khách trên máy bay                   , ít có cô hộ sống sót cho các hành khách khách trên mấy bay
trung quốc đưa ra hình phạt cụ thể đối với tội tham nhũng               , trung quốc đưa ra ra hình phạt cụ thể đối với với tổi tham nhũng
hai cháu ngạc nhiên đón khách lạ sung sướng ôm cặp mới                  , hanh cháu ngạc nhuyên đón khách lạ xung phiến ông cặp mới
nhưng cô quyết chứng minh người mù không phải vô dụng                   , nhưng cô quyết chứng minh người mù không phải vô dụng
họ đã trao nhau lời hẹn ước nên duyên chồng vợ                          , họ đã trao nhau lời hiện ước nên nguyên chồng vợo
nếu thỉnh thoảng có vài ngày nghỉ người thụy điển thường ra đảo chơi    , néo thỉnh thoảng có vai ngày nghỉ người thự điển thường ra đảo chơi
những người cô lập mình có thể gặp phải chứng trầm cảm hoặc lo lắng     , những người cô lập mình có thể rập phải chứng trầm cảm hoặc lao lắng
thực tế vai trò của bạn và người phỏng vấn đối chiếu nhau               , thuật tế vai trò của bạn và người phỏng vấn đối chiếu nhau
sự giúp đỡ của bà là vô cùng quí báu cho chúng tôi                      , sự giúp đỡ của bà là vuột cùng quý báo cho chúng tôi
nhà trường đột ngột hủy đề tài khiến tôi mất phương hướng               , ngà trường đột ngột hủy đề tài khiến tôi mắt phương hướng hướng
các phật tử hưởng ứng lời kêu gọi của thầy như thế nào                  , các phật tử hượuợng ấn lời kâu vỏi của thầy như thấy nào
vậy những đối tượng này sẽ được giải quyết như thế nào                  , vài những đối tượng này sẽ được giải quyết như thế nào
xen kẽ giữa những màn biểu diễn là những phút vui chơi tập thể          , sang kể dựa những màng biểu diễn là những phút vui cho tập thể
sáng ra thấy dân tình xúm quanh con tê giác khổng lồ đã chết            , sáng ra thấy dân tình súng quanh con tê giác cổng lù đã chết
và một điều sâu xa là mình đã thật sự yêu bạn                           , và một điều sau xa là mình đã thực sự yêu bạn
nhiều hôm mưa gió bán ế gánh chè nặng trĩu trên vai mẹ                  , nhiều hơn mưu gió bán ế gánh chèn nặng triệu trên vai mẹ
phía dưới và xung quanh kệ là nước bẩn lênh láng chảy qua               , phí dưới và xung quanh kể là nước bỏn lên lán trải hoa
tôi đứng trước hai lối rẽ và tôi chọn con đường ít người đi hơn         , tôi đứng trước hai lốt rẻ và tôi chọn con đường ít người đi hơn
chúng tôi đã điều tra những trường hợp có nghi vấn gian dối             , chúng tôi đã điều tra những trường hợp có nghi vấn giũi
vậy chừng nào mới tới xin lỗi nhân dân tập cuối                         , vậy chừng nào mớt tối phin lỗi nhân dân tật cuối
hôm nào tan ca sớm hạnh được giao nhiệm vụ đi chợ cho bữa tối           , hôm nào tan ca sốm hạnh được do nhiệm vũ đi chờ cho buổi tối
vào được nhà anh đấy sửa cửa đi nguy hiểm đấy                           , vào được nhà anh đấy dự của đi người hiểm đấy
rồi mặc dù biết là ngớ ngẩn tôi cứ nói ra                               , rồi mặn dù biết là ngớn ngọn tôi cứ nói ra
riêng ông nguyễn văn ba bị gỗ đè dập sọ não chết ngay tại chỗ           , ghiên ông nguyễn văn ba bị rỗ đè dập sọ nạo trất ngay tải chỗ
mỗi người nở một nụ cười với những ý nghĩa khác nhau                    , mỗi người nỡ một nủ cười với với với những ý nghĩa khác nhau
do vậy sẽ ảnh hưởng tới việc thu sóng vô tuyến                          , doa vảy sạn hưởng tới việt thu sống vồ tuyển
phim chiếu nguyên bản tiếng pháp có phụ đề tiếng việt                   , phim chiếu nguyên bạn tiếng pháp có phủ đề tuyến việc
bóng màu xanh là vùng tâm bão có thể đi qua                             , bóng một sanh là vùng tâm bảo có thể đi quan
sau một ngày lao động căng mệt bạn ưu tiên chọn                         , sau một ngày lao động căng mờt bản ưu tiên chọn
hà cũng chẳng nhớ mình có nói hay không để cãi lại ông ấy               , hà cũng chận nhớ mình có nói hay không để cả lại ông ấy
bản thân tôi cũng tham gia một vai rất nhỏ nữa                          , bản thân tôi cũng tham gia một vai đất nhỏ nữa
hôm sau mở máy thấy cái truyện đã tự hoàn chỉnh rồi                     , hơm sau mở máy thấy cái chuyển đã tử hoàn chỉnh rồi
bây giờ thì đáng được khen là thông minh chứ hả                         , bị giờ thị đáng được hen là thông minh chứ hản
chị tìm nhà cho em ở trọ ngay cổng trường chị học                       , chỉ tìm nhà cho em ở chọ ngay cổng trường chỉ học
đến đà lạt bạn phải chuẩn bị đôi chân để đi bộ                          , đến đa lạc bản phải chuỗng bị đôi chân để đi bộ
họ được bọn đầu nậu những tay trùm thuê với giá rẻ mạt                  , họ được bọn đầu nậu những tây trồng thuê với giá rễ mạc
một bà sang trọng đến gặp bác sĩ trẻ khám bệnh bác sĩ hỏi               , một bà sang chọng đến gọc bác sự chẻ khắm bệnh bác sự hỏi
nhân lực ngành thiết kế đồ họa đắt giá và khan hiếm                     , nhưng lực ngạnh thiết kế đồ hỏa đắt giá và khang hiế m
sau đó bản thân học sinh phải làm đơn xin học bổng                      , sau đó bản thân học sinh phải làm đơn sinh học bọng
chỉ có thực phẩm mới giúp bạn làm được việc này                         , chỉ có thực phẩm mới giúp bản làm được việt này
với các dát màu cà phê sữa không cần điều trị                           , với các giác mậu cả phê sựa không cần đều trị
họ bảo tôi giống người hàn thì tôi lại thấy họ giống người việt         , họ bảo tôi giống như người hàng thì tôi lại thấy họ giống người việc
và đội tuyển pháp đang là đội chiếm ưu thế hơn so với thụy sĩ           , và đổi tuyển pháp đang là đội chím u thế hơn so với thuổi sĩ
trình độ chuyên môn của cô khiến cô quá thừa tư cách                    , chình đổi chuyên môn của cô khiến cô quá thừa từa cấp
những câu hỏi trên sẽ giúp bạn làm được điều này                        , những câu hỏi trên sẽ giúp bạn làm được điều này
vẫn còn nhưng bạn không dám chắc họ có hạnh phúc hay không              , vựng còn nhưng bạn không giám chất hỏ có hạnh phúc hay không
đó cũng là sự tiếp xúc gần gũi nhất của bọn em                          , đó cũng là sử tuyếp xúc gần gủa nhất của bọn em
em hãy tỉnh táo mà tìm những định hướng tốt hơn cho tương lai           , em hạy tịnh táo mà tìm những định hướng tốt hơn cho tương lai
nhưng chẳng có điểm sản xuất nào dùng bạt phủ che chắn                  , nhưng chận có điểm sản xuất nào dùng bạc phụ che chấn
có mấy người đụng phải nó suýt ngã chúi xuống đường                     , có mán người đụng phải nó suốt ngại chúi xuống đường
đoàn đi thuyền đến một khu làng dân tộc thiểu số                        , đoàn đi thuyền đến một khu làng nhưng tộc thể số
thì hợp đồng thế chấp này cũng không có giá trị pháp lý                 , thì học đồng thấy chấp này cũng không có giáo chỉ pháp lý
ba tôi hãnh diện nói chuyện với số học sinh cùng lên xe đò              , ba tôi hảnh diễn nói chuyển với số học sinh cũng lên xe đò
một anh trai tuấn đang ngồi tù vì tội giết người                        , một anh trai tuấn đang ngồi tù vì tổi diết người
được bày trên những bệ thờ bên cạnh những bó sen huệ thơm nức           , được bầy trên những bẽ thờ bên cảnh những bóa sen hỏe thông phức
các bước sau đây sẽ giúp bạn tìm ra ứng cử viên thích hợp               , các bước sau đây sẽ giúp bạn tiềm ra ứng cử viên thích họp
vì chúng có thể làm răng của bạn dễ bị ố vàng                           , vì chúng có thể làm răng của bạn dễ bị ổ vàng
giải nhất huy chương vàng thuộc về nhà nhiếp ảnh của cộng hòa séc       , giải nhất huy trưng vàng thuộc về nhà nhấp ảnh cuộc cổng hoa xét
để xin thị thực công tác về cơ bản bạn phải có                          , để sinh thỉ thực công tác về cơ bạn bạn phải có
tôi nắm bàn tay xưa ba tôi từng thương yêu đau xót cầm giữ              , tôi nắm bạn tay sưa ba tôi từng thư tôi nâu soc cầm giữ
trong dòng thác người chỉ nhìn được mắt kính và khẩu trang              , trong dòng thác người chỉ nhìn được mất kính và khẩu trang
khai mạc triển lãm quy mô lớn về tranh sơn mài việt nam                 , khai mạc chuyện lạm vuy mua lớn về tranh sơn mài việt nam
không nên chỉ dựa vào bài viết của bạn để thuyết minh thêm              , không nen chỉ giễ vều vào bài viết của bạn đẹt rít minh thêm
và giáo dục con người trở thành việc luyện trí nhớ                      , vài giảo dục có người trỗ thành việc luyện chỉ nhớ
tuy nhiên hợp đồng này chỉ có giá trị trong những ngày bình thường      , then thanh yên hợp đồng này chỉ cọ già trị trong những ngày bình thường
vấn đề đặt ra ở đây là làm thế nào để                                   , vựnh đề địch ra ở đây là là làm thị nào đễ
nhưng nhiều du khách thấy thất vọng khi lên đến nơi                     , nhưng nhiều du khách vận thảy tấp vọng khi lên địn nơi
trên mặt ai cũng có khăn tay khẩu trang che miệng                       , chai mặt ai cũng có khanh tay khậu trang che miệng
càng ngày mình càng nghĩ nhiều về công việc giảng dạy                   , căn ngay mình cần nghĩ nhiều về con việc giản giải
tất nhiên hóa đơn tiền nước cũng kèm luôn khoản tiền                    , tách nhinh hạ đôn tiền nước cũng kèn theo luôn khoản tiền
chúc bạn đọc có thật nhiều thời gian thư giãn thoải mái                 , bạn đọc có thật nhiều thời gian thu giản thoải mại
hàng chân mày đen và xếch không lẫn vào đâu được                        , hạng tranh mầy đen và sách không lệnh vào đâu được
cả ngày trời không nắng gió lạnh nên thưa vắng du khách                 , ngày trời không nặng gió lạnh nên tưa vẫn du khách
làm được hết khối công việc ấy là một nỗ lực rất lớn                    , lực hết khỏi công việc ấy là một nỗi lực rất lớn lực rất lớn
người ăn xin thưa bà ngày thường thì bà cho gì cũng được                , người anh xin tưa bà ngày thường thì bào cho gia cũng được
bạn không bao giờ ra ngoài mà không dùng kem lót                        , bạn không bao giờ ra ngoài mà không dùng kem lót
vài lần triển lãm tranh tượng không lời như thế hắn sẽ nhận ra          , vài làn triển làm tranh tuạn không lời nhea thấy hãnh sẽ ngạn ra
người đàn ông trên giường thình lình rên lên một tiếng rồi mở mắt       , người đành ông trên dường thình lình rên lên một tiững rồi mở mắt
tối qua người ta đến bắt tôi giữa đêm hôm khuya khoắt                   , tối qua người ta địn bắp tôi giữa đem hôn khuya khoách
bảo thằng quyết nó bắt con gà sống nâu mà thịt                          , bảo thần thận quyết nọa bắt con rào sống nâu mà thịp
